{
  "schema_version": 1,
  "artifact_type": "repository_lifecycle_receipt",
  "receipt_id": "repository-lifecycle-receipt:example-archive-001",
  "request_ref": {
    "uri": "https://oos.local/repository-lifecycle/requests/example-archive-001",
    "digest": "sha256:6666666666666666666666666666666666666666666666666666666666666666"
  },
  "decision_ref": {
    "uri": "https://wgcf.local/repository-lifecycle/decisions/example-archive-001",
    "digest": "sha256:7777777777777777777777777777777777777777777777777777777777777777"
  },
  "provider_readback_ref": {
    "uri": "https://oos.local/repository-lifecycle/readbacks/example-archive-001",
    "digest": "sha256:8888888888888888888888888888888888888888888888888888888888888888"
  },
  "completed_at": "2026-08-30T02:03:00Z",
  "action": "archive-provider",
  "outcome": "succeeded",
  "repository_identity": {
    "provider": "github",
    "provider_repository_id": "123456789"
  },
  "before": {
    "custody_state": "linked",
    "workspace_owner_ref": "repo:example-repository",
    "provider_lifecycle_state": "active",
    "workspace_record_state": "active",
    "custody_version": "custody-v4",
    "provider_version": "provider-v8"
  },
  "after": {
    "custody_state": "linked",
    "workspace_owner_ref": "repo:example-repository",
    "provider_lifecycle_state": "archived",
    "workspace_record_state": "active",
    "custody_version": "custody-v5",
    "provider_version": "provider-v9"
  },
  "impact_assessment_ref": {
    "uri": "https://wgcf.local/repository-impact/example-archive-001",
    "digest": "sha256:2222222222222222222222222222222222222222222222222222222222222222"
  },
  "blocker_disposition": null,
  "confirmations": {
    "operator_approval_ref": {
      "uri": "https://workspace-governance.local/approvals/repository-lifecycle/example-archive-001",
      "digest": "sha256:4444444444444444444444444444444444444444444444444444444444444444"
    },
    "source_owner_acceptance_ref": null,
    "target_owner_acceptance_ref": null,
    "provider_credential_binding_ref": {
      "uri": "https://platform-engineering.local/credential-bindings/github-app/repository-lifecycle",
      "digest": "sha256:5555555555555555555555555555555555555555555555555555555555555555"
    }
  },
  "reversal_of_receipt_ref": null,
  "history_event_ref": {
    "uri": "https://oos.local/repository-lifecycle/history/example-archive-001",
    "digest": "sha256:9999999999999999999999999999999999999999999999999999999999999999"
  },
  "downstream_mutation": "none",
  "workflow_status": "succeeded",
  "findings": [],
  "integrity": {
    "canonicalization": "RFC8785",
    "algorithm": "sha256",
    "content_digest": "sha256:aaaaaaaaaaaaaaaaaaaaaaaaaaaaaaaaaaaaaaaaaaaaaaaaaaaaaaaaaaaaaaaa"
  }
}
